{
  "binary_version": "\u003cstripped\u003e",
  "content_hash": "\u003cstripped\u003e",
  "event_type": "lifecycle",
  "generation": 1,
  "lifecycle": {
    "details": {
      "k": "v"
    },
    "subsystem": "gateway",
    "transition": "start"
  },
  "run_id": "\u003cstripped\u003e",
  "schema_version": 7,
  "severity": "INFO",
  "sidecar_instance_id": "\u003cstripped\u003e",
  "ts": "2000-01-01T00:00:00Z"
}