{
  "binary_version": "\u003cstripped\u003e",
  "content_hash": "\u003cstripped\u003e",
  "event_type": "judge",
  "generation": 1,
  "judge": {
    "action": "block",
    "input_bytes": 20,
    "kind": "pii",
    "latency_ms": 7,
    "model": "gpt-4",
    "raw_response": "{}",
    "severity": "HIGH"
  },
  "model": "gpt-4",
  "run_id": "\u003cstripped\u003e",
  "schema_version": 7,
  "severity": "HIGH",
  "sidecar_instance_id": "\u003cstripped\u003e",
  "ts": "2000-01-01T00:00:00Z"
}