{
  "activity": {
    "action": "policy-update",
    "actor": "op",
    "after": {
      "v": 2
    },
    "before": {
      "v": 1
    },
    "target_id": "p1",
    "target_type": "policy"
  },
  "binary_version": "\u003cstripped\u003e",
  "content_hash": "\u003cstripped\u003e",
  "event_type": "activity",
  "generation": 1,
  "run_id": "\u003cstripped\u003e",
  "schema_version": 7,
  "severity": "INFO",
  "sidecar_instance_id": "\u003cstripped\u003e",
  "ts": "2000-01-01T00:00:00Z"
}